name,price
A Light in the ...,£51.77
The Black Maria,£52.15
Shakespeare's Sonnets,£20.66
Olio,£23.88
You can't bury them ...,£33.63
Slow States of Collapse: ...,£57.31
Untitled Collection: Sabbath Poems ...,£14.27
Poems That Make Grown ...,£14.19
Night Sky with Exit ...,£41.05
salt.,£46.78
Quarter Life Poetry: Poems ...,£50.89
Out of Print: City ...,£53.64
Les Fleurs du Mal,£29.04
Howl and Other Poems,£40.45
Leave This Song Behind: ...,£51.17
The Collected Poems of ...,£15.42
The Crossover,£38.77
Booked,£17.49
Twenty Love Poems and ...,£30.95
Without Borders (Wanderlove #1),£45.07
The Mistake (Off-Campus #2),£43.29
The Matchmaker's Playbook (Wingmen ...,£55.85
The Hook Up (Game ...,£36.29
Shameless,£58.35
Off Sides (Off #1),£39.45
The Book of Basketball: ...,£44.84
Friday Night Lights: A ...,£51.22
Sugar Rush (Offensive Line ...,£24.42
Settling the Score (The ...,£44.91
Icing (Aces Hockey #2),£40.44
The Coming Woman: A ...,£17.93
The Boys in the ...,£22.60
Starving Hearts (Triangular Trade ...,£13.99
America's Cradle of Quarterbacks: ...,£22.50
Aladdin and His Wonderful ...,£53.13
Penny Maybe,£33.29
Maude (1883-1993):She Grew Up ...,£18.02
The Inefficiency Assassin: Time ...,£20.59
Soul Reader,£39.58
Bossypants,£49.46
A World of Flavor: ...,£42.95
"A Piece of Sky, ...",£56.76
Tracing Numbers on a ...,£41.60
Thirteen Reasons Why,£52.72
The Secret (The Secret ...,£27.37
The Psychopath Test: A ...,£36.00
The Kite Runner,£41.82
The Girl on the ...,£55.02
The Emerald Mystery,£23.15
The Bridge to Consciousness: ...,£32.00
The Requiem Red,£22.65
Set Me Free,£17.46
The Natural History of ...,£45.22
Obsidian (Lux #1),£14.86
Burning,£28.81
A Fierce and Subtle ...,£28.13
Scarlett Epstein Hates It ...,£43.55
"Nightingale, Sing",£38.28
Library of Souls (Miss ...,£48.56
Frostbite (Vampire Academy #2),£29.99
Wild Swans,£14.36
Until Friday Night (The ...,£46.31
This Is Where It ...,£27.12
The Darkest Lie,£35.35
My Kind of Crazy,£40.36
Don't Get Caught,£55.35
Catching Jordan (Hundred Oaks),£50.83
Aristotle and Dante Discover ...,£58.14
The Epidemic (The Program ...,£14.44
Stars Above (The Lunar ...,£48.05
The Torch Is Passed: ...,£19.09
The Mindfulness and Acceptance ...,£23.89
The Art Forger,£40.76
On a Midnight Clear,£14.07
Judo: Seven Steps to ...,£53.90
"Shobu Samurai, Project Aryoku ...",£29.06
Modern Romance,£28.26
The White Queen (The ...,£25.91
The Song of Achilles,£37.40
The Immortal Life of ...,£40.67
The Dovekeepers,£48.78
More Than Music (Chasing ...,£37.61
Code Name Verity (Code ...,£22.13
Cell,£20.29
Angels Walking (Angels Walking ...,£34.20
A Series of Catastrophes ...,£56.48
A People's History of ...,£40.79
A Brush of Wings ...,£55.51
Rook,£37.86
The Midnight Watch: A ...,£26.20
Mesaerion: The Best Science ...,£37.59
Join,£35.67
William Shakespeare's Star Wars: ...,£43.30
The Project,£10.65
Soft Apocalypse,£26.12
Sleeping Giants (Themis Files ...,£48.74
Arena,£21.36
Foundation (Foundation (Publication Order) ...,£32.42
The Restaurant at the ...,£10.92
Ready Player One,£19.07
"Life, the Universe and ...",£33.26
Dune (Dune #1),£54.86
Do Androids Dream of ...,£51.48
Three Wishes (River of ...,£44.18
The Last Girl (The ...,£36.26
Having the Barbarian's Baby ...,£34.96
Unicorn Tracks,£18.78
"Saga, Volume 6 (Saga ...",£25.02
Princess Between Worlds (Wide-Awake ...,£13.34
Masks and Shadows,£56.40
Crown of Midnight (Throne ...,£43.29
Avatar: The Last Airbender: ...,£28.09
A Court of Thorns ...,£52.37
Throne of Glass (Throne ...,£35.07
The Glittering Court (The ...,£44.28
Hollow City (Miss Peregrine’s ...,£42.98
The Star-Touched Queen,£46.02
The Hidden Oracle (The ...,£52.26
The Most Perfect Thing: ...,£42.96
Immunity: How Elie Metchnikoff ...,£57.36
Sorting the Beef from ...,£44.74
Tipping Point for Planet ...,£37.55
The Fabric of the ...,£55.91
Diary of a Citizen ...,£28.41
The Origin of Species,£10.01
The Grand Design,£13.76
Peak: Secrets from the ...,£16.28
"The Elegant Universe: Superstrings, ...",£13.03
The Disappearing Spoon: And ...,£57.35
"Surely You're Joking, Mr. ...",£25.83
Seven Brief Lessons on ...,£30.60
The Selfish Gene,£29.45
Rip it Up and ...,£35.02
Our Band Could Be ...,£57.25
How Music Works,£37.32
Love Is a Mix ...,£18.03
Please Kill Me: The ...,£31.19
Kill 'Em and Leave: ...,£45.05
"Chronicles, Vol. 1",£52.60
This Is Your Brain ...,£38.40
Orchestra of Exiles: The ...,£12.36
No One Here Gets ...,£20.02
Life,£31.58
Old Records Never Die: ...,£55.66
Forever Rockers (The Rocker ...,£28.80
Worlds Elsewhere: Journeys Around ...,£40.30
The Five Love Languages: ...,£31.05
Reasons to Stay Alive,£26.41
#HigherSelfie: Wake Up Your ...,£23.11
Unseen City: The Majesty ...,£44.18
Throwing Rocks at the ...,£31.12
The Life-Changing Magic of ...,£16.77
The Gutsy Girl: Escapades ...,£37.13
The Electric Pencil: Drawings ...,£56.06
Spark Joy: An Illustrated ...,£41.83
Reskilling America: Learning to ...,£19.83
In the Country We ...,£22.00
Everydata: The Misinformation Hidden ...,£54.35
Call the Nurse: True ...,£29.14
Algorithms to Live By: ...,£30.81
The Power of Now: ...,£43.54
The Omnivore's Dilemma: A ...,£38.21
The Genius of Birds,£17.24
The Artist's Way: A ...,£38.49
So You've Been Publicly ...,£12.23
The Bane Chronicles (The ...,£44.73
Island of Dragons (Unwanteds ...,£29.65
Demigods & Magicians: Percy ...,£37.51
City of Glass (The ...,£56.02
Searching for Meaning in ...,£38.73
The Star-Touched Queen,£32.30
A Shard of Ice ...,£56.63
King's Folly (The Kinsman ...,£39.61
Don't Be a Jerk: ...,£37.97
You Are What You ...,£21.87
God: The Most Unpleasant ...,£30.03
The Book of Mormon,£24.57
A History of God: ...,£27.62
The Bhagavad Gita,£57.49
Choosing Our Religion: The ...,£28.42
Birdsong: A Story in ...,£54.64
The Bear and the ...,£36.89
The Secret of Dreadwillow ...,£56.13
The White Cat and ...,£58.08
Little Red,£13.47
Walt Disney's Alice in ...,£12.96
Twenty Yawns,£22.08
Rain Fish,£23.57
Once Was a Time,£18.28
Luis Paints the World,£53.95
Nap-a-Roo,£25.08
The Whale,£35.96
"Shrunken Treasures: Literary Classics, ...",£52.87
Raymie Nightingale,£34.41
Playing from the Heart,£32.38
Maybe Something Beautiful: How ...,£22.54
The Wild Robot,£56.07
The Thing About Jellyfish,£48.77
The Lonely Ones,£43.59
I Had a Nice ...,£57.36
Will You Won't You ...,£13.86
Keep Me Posted,£20.46
Grey (Fifty Shades #4),£48.49
Meternity,£43.58
Some Women,£13.73
Shopaholic Ties the Knot ...,£48.39
Can You Keep a ...,£21.94
Twenties Girl,£42.80
The Undomestic Goddess,£45.75
The Nanny Diaries (Nanny ...,£52.53
The Devil Wears Prada ...,£44.29
Something Borrowed (Darcy & ...,£48.96
Something Blue (Darcy & ...,£54.62
I've Got Your Number,£19.69
The Edge of Reason ...,£19.18
Bridget Jones's Diary (Bridget ...,£29.82
Soumission,£50.10
Private Paris (Private #10),£47.61
"We Love You, Charlie ...",£50.27
Thirst,£17.27
The Murder That Never ...,£54.11
Tuesday Nights in 1980,£21.04
The Vacationers,£42.15
The Regional Office Is ...,£51.36
Finders Keepers (Bill Hodges ...,£53.53
The Time Keeper,£27.88
The Testament of Mary,£52.67
The First Hostage (J.B. ...,£25.85
Take Me with You,£45.21
Still Life with Bread ...,£26.41
Shtum,£55.84
My Name Is Lucy ...,£41.56
My Mrs. Brown,£24.48
Mr. Mercedes (Bill Hodges ...,£28.90
I Am Pilgrim (Pilgrim ...,£10.60
Eligible (The Austen Project ...,£27.09
Amid the Chaos,£36.58
Dark Notes,£19.19
Chase Me (Paris Nights ...,£25.27
Black Dust,£34.53
Her Backup Boyfriend (The ...,£33.97
First and First (Five ...,£15.97
Fifty Shades Darker (Fifty ...,£21.96
The Wedding Dress,£24.12
Suddenly in Love (Lake ...,£55.99
Something More Than This,£16.24
Doing It Over (Most ...,£35.61
The Wedding Pact (The ...,£32.61
Hold Your Breath (Search ...,£28.82
Dirty (Dive Bar #1),£40.83
Take Me Home Tonight ...,£53.98
Off the Hook (Fishing ...,£47.67
A Gentleman's Position (Society ...,£14.75
"Sit, Stay, Love",£20.90
The Long Shadow of ...,£10.97
Libertarianism for Beginners,£51.33
Why the Right Went ...,£52.65
Equal Is Unfair: America's ...,£56.86
The Bulletproof Diet: Lose ...,£49.05
"Eat Fat, Get Thin",£54.07
10-Day Green Smoothie Cleanse: ...,£49.71
The Art and Science ...,£52.98
The Day the Crayons ...,£26.33
Suzie Snowflake: One beautiful ...,£54.81
The Grownup,£35.88
Silence in the Dark ...,£58.33
(Un)Qualified: How God Uses ...,£54.00
Crazy Love: Overwhelmed by ...,£47.72
Blue Like Jazz: Nonreligious ...,£25.77
All the Light We ...,£29.87
The Girl You Left ...,£15.79
Online Marketing for Busy ...,£46.35
How to Be Miserable: ...,£46.03
"Overload: How to Unplug, ...",£52.15
You Are a Badass: ...,£12.08
How to Stop Worrying ...,£46.49
A Girl's Guide to ...,£31.30
The Perfect Play (Play ...,£59.99
Dark Lover (Black Dagger ...,£12.87
Changing the Game (Play ...,£13.38
Logan Kade (Fallen Crest ...,£13.12
The Four Agreements: A ...,£17.66
The Activist's Tao Te ...,£32.24
Chasing Heaven: What Dying ...,£37.80
If I Gave You ...,£20.91
Unreasonable Hope: Finding Faith ...,£46.33
A New Earth: Awakening ...,£55.65
When We Collided,£31.77
Someone Like You (The ...,£52.79
We Are All Completely ...,£24.04
In Her Wake,£12.84
The Elephant Tree,£23.82
Behind Closed Doors,£52.22
You (You #1),£43.61
The Guilty (Will Robie ...,£13.82
The 14th Colony (Cotton ...,£39.24
Give It Back,£18.32
Killing Floor (Jack Reacher ...,£31.49
The Bone Hunters (Lexy ...,£59.71
Far From True (Promise ...,£34.93
The Travelers,£15.77
Louisa: The Extraordinary Life ...,£16.85
Setting the World on ...,£21.15
The Faith of Christopher ...,£39.55
Benjamin Franklin: An American ...,£48.19
The Rise of Theodore ...,£42.57
The Dirty Little Secrets ...,£33.34
The Third Wave: An ...,£12.61
The 10% Entrepreneur: Live ...,£27.55
Shoe Dog: A Memoir ...,£23.99
Made to Stick: Why ...,£38.85
Quench Your Own Thirst: ...,£43.14
The Art of Startup ...,£21.00
Born for This: How ...,£21.59
The E-Myth Revisited: Why ...,£36.91
"Rich Dad, Poor Dad",£51.74
The Lean Startup: How ...,£33.92
Rework,£44.88
Redeeming Love,£20.47
Close to You,£49.46
Shadows of the Past ...,£39.67
Like Never Before (Walker ...,£28.77
Counted With the Stars ...,£17.97
If I Run (If ...,£49.97
Foolproof Preserving: A Guide ...,£30.52
The Pioneer Woman Cooks: ...,£56.41
My Paris Kitchen: Recipes ...,£33.37
Mama Tried: Traditional Italian ...,£14.02
"Layered: Baking, Building, and ...",£40.11
The Nerdy Nummies Cookbook: ...,£37.34
The Love and Lemons ...,£37.60
The Cookies & Cups ...,£41.25
Deliciously Ella Every Day: ...,£42.16
The Help Yourself Cookbook ...,£28.77
"It's All Easy: Healthy, ...",£19.55
Barefoot Contessa Back to ...,£28.01
Barefoot Contessa at Home: ...,£50.62
My Kitchen Year: 136 ...,£11.53
Everyday Italian: 125 Simple ...,£20.10
A la Mode: 120 ...,£38.77
Cravings: Recipes for What ...,£20.50
Sapiens: A Brief History ...,£54.23
Unbound: How Eight Technologies ...,£25.52
The Age of Genius: ...,£19.73
"Political Suicide: Missteps, Peccadilloes, ...",£36.28
Thomas Jefferson and the ...,£59.64
Zealot: The Life and ...,£24.70
A Distant Mirror: The ...,£14.58
1491: New Revelations of ...,£21.80
Brilliant Beacons: A History ...,£11.45
"""Most Blessed of the ...",£44.48
A Short History of ...,£52.40
The Rise and Fall ...,£39.67
Catherine the Great: Portrait ...,£58.55
The Mathews Men: Seven ...,£42.91
The Hiding Place,£55.91
America's War for the ...,£51.22
The Guns of August,£14.54
House of Lost Worlds: ...,£43.70
Security,£39.25
Follow You Home,£21.36
The Loney,£23.40
Pet Sematary,£10.56
Doctor Sleep (The Shining ...,£40.12
Psycho: Sanitarium (Psycho #1.5),£36.97
Can You Keep a ...,£48.64
Red Dragon (Hannibal Lecter ...,£23.37
Dracula the Un-Dead,£35.63
Night Shift (Night Shift ...,£12.75
Needful Things,£47.51
Misery,£34.79
It,£25.01
'Salem's Lot,£49.56
The Moosewood Cookbook: Recipes ...,£12.34
32 Yolks,£53.63
Naturally Lean: 125 Nourishing ...,£11.38
The Stand,£57.86
The Girl with All ...,£49.47
House of Leaves,£54.89
The Long Haul (Diary ...,£44.07
Old School (Diary of ...,£11.83
I Know What I'm ...,£25.98
Hyperbole and a Half: ...,£14.75
Dress Your Family in ...,£43.68
Toddlers Are A**holes: It's ...,£25.55
When You Are Engulfed ...,£30.89
Naked,£31.69
Lamb: The Gospel According ...,£55.50
Holidays on Ice,£51.07
Fifty Shades Freed (Fifty ...,£15.36
Catastrophic Happiness: Finding Joy ...,£37.35
The Argonauts,£10.93
M Train,£27.18
Lab Girl,£40.85
Approval Junkie: Adventures in ...,£58.81
Running with Scissors,£12.91
Me Talk Pretty One ...,£57.60
Lust & Wonder,£11.87
Life Without a Recipe,£59.04
A Heartbreaking Work of ...,£54.29
The Lucifer Effect: Understanding ...,£10.40
The Golden Condom: And ...,£39.43
It Didn't Start with ...,£56.27
An Unquiet Mind: A ...,£21.30
"Thinking, Fast and Slow",£21.14
Civilization and Its Discontents,£59.95
8 Keys to Mental ...,£31.04
Wall and Piece,£44.18
Feathers: Displays of Brilliant ...,£49.05
Art and Fear: Observations ...,£48.63
The New Drawing on ...,£43.02
History of Beauty,£10.29
The Story of Art,£41.14
The Art Book,£32.34
Ways of Seeing,£39.51
"Vampire Knight, Vol. 1 ...",£15.40
Sophie's World,£15.94
The Death of Humanity: ...,£58.11
The Stranger,£17.44
Proofs of God: Classical ...,£54.21
Kierkegaard: A Christian Missionary ...,£47.13
At The Existentialist Café: ...,£29.93
Critique of Pure Reason,£20.75
"Run, Spot, Run: The ...",£20.02
The Nicomachean Ethics,£36.34
Meditations,£25.89
Beyond Good and Evil,£43.38
The Secret Garden,£15.08
The Metamorphosis,£28.58
The Pilgrim's Progress,£50.26
The Hound of the ...,£14.82
Little Women (Little Women ...,£28.07
Gone with the Wind,£32.49
Candide,£58.63
Animal Farm,£57.22
Wuthering Heights,£17.73
The Picture of Dorian ...,£29.70
The Complete Stories and ...,£26.78
Beowulf,£38.35
And Then There Were ...,£35.01
The Story of Hong ...,£43.19
The Little Prince,£45.42
Sense and Sensibility,£37.46
Of Mice and Men,£47.11
Scott Pilgrim's Precious Little ...,£52.29
Tsubasa: WoRLD CHRoNiCLE 2 ...,£16.28
This One Summer,£19.49
The Nameless City (The ...,£38.16
"Saga, Volume 5 (Saga ...",£51.04
"Rat Queens, Vol. 3: ...",£50.40
"Princess Jellyfish 2-in-1 Omnibus, ...",£13.61
"Pop Gun War, Volume ...",£18.97
Patience,£10.16
"Outcast, Vol. 1: A ...",£15.44
orange: The Complete Collection ...,£48.41
"Lumberjanes, Vol. 2: Friendship ...",£46.91
"Lumberjanes, Vol. 1: Beware ...",£45.61
Lumberjanes Vol. 3: A ...,£19.92
"I Hate Fairyland, Vol. ...",£29.17
I am a Hero ...,£54.63
"Giant Days, Vol. 2 ...",£22.11
Danganronpa Volume 1,£51.99
"Codename Baboushka, Volume 1: ...",£36.72
Camp Midnight,£17.08
Tipping the Velvet,£53.74
Forever and Forever: The ...,£29.69
A Flight of Arrows ...,£55.53
The House by the ...,£36.95
Mrs. Houdini,£30.25
The Marriage of Opposites,£28.08
Glory over Everything: Beyond ...,£45.84
"Love, Lies and Spies",£20.55
A Paris Apartment,£39.01
Lilac Girls,£17.28
The Constant Princess (The ...,£16.62
The Invention of Wings,£37.34
World Without End (The ...,£32.97
The Passion of Dolssa,£28.32
Girl With a Pearl ...,£26.77
Voyager (Outlander #3),£21.07
The Red Tent,£35.66
The Last Painting of ...,£55.55
The Guernsey Literary and ...,£49.53
Girl in the Blue ...,£46.83
Sharp Objects,£47.82
"In a Dark, Dark ...",£19.63
The Past Never Ends,£56.50
A Murder in Time,£16.64
The Murder of Roger ...,£44.10
The Last Mile (Amos ...,£54.21
That Darkness (Gardiner and ...,£13.92
Tastes Like Fear (DI ...,£10.69
A Time of Torment ...,£48.35
A Study in Scarlet ...,£16.73
Poisonous (Max Revere Novels ...,£26.80
Murder at the 42nd ...,£54.36
Most Wanted,£35.28
Hide Away (Eve Duncan ...,£11.84
Boar Island (Anna Pigeon ...,£59.48
The Widow,£27.26
Playing with Fire,£13.71
What Happened on Beale ...,£25.37
The Bachelor Girl's Guide ...,£52.30
Delivering the Truth (Quaker ...,£20.89
Emma,£32.93
Alice in Wonderland (Alice's ...,£55.53
It's Only the Himalayas,£45.17
Full Moon over Noah’s ...,£49.43
See America: A Celebration ...,£48.87
Vagabonding: An Uncommon Guide ...,£36.94
Under the Tuscan Sun,£37.33
A Summer In Europe,£44.34
The Great Railway Bazaar,£30.54
A Year in Provence ...,£56.88
The Road to Little ...,£23.21
Neither Here nor There: ...,£38.95
"1,000 Places to See ...",£26.08
